{
  "schema_version": "0.1.0",
  "id": "7c2e1f3a-4b5d-4e6f-8a9b-0c1d2e3f4a5b",
  "server": "gb",
  "season": 42,
  "damage": 251.3,
  "submitted_at": "2026-10-23T11:02:40Z",
  "client": {
    "turnstile": true,
    "season_key": "9b74c9897bac770ffc029102a200c5de4d1e8f0a6c2b5e3f4a1d7c9e2b6f8a01",
    "browser_key": "4c1d7e2a9f3b8c6d5e0a1b2c3d4e5f60718293a4b5c6d7e8f90a1b2c3d4e5f6a"
  },
  "rank_n": 87
}
